{
  "schema": "pharma.external-workbench-capability-matrix.v1",
  "schema_version": 1,
  "goal_document_id": "PIP-GOAL-001",
  "goal_version": "1.10.1",
  "reviewed_at": "2026-08-04",
  "completion_rule": {
    "required_domain_count": 12,
    "required_priorities": [
      "P0",
      "P1"
    ],
    "required_status": "implemented",
    "requires_real_data": true,
    "requires_business_uat": true,
    "requires_experience_gate": true
  },
  "experience_gate": {
    "required_status": "implemented",
    "criteria": [
      {
        "id": "module_coverage_and_discoverability",
        "status": "implemented",
        "evidence": [
          "docs/reference-query-workflow-audit.md",
          "docs/research-workbench-architecture.md",
          "docs/design-qa.md",
          "apps/web/src/ResearchApp.tsx",
          "apps/web/src/views/CommercialView.tsx",
          "apps/web/src/views/WorkspaceExportPolicyPanel.tsx",
          "apps/web/src/components/WorkspaceShell.tsx",
          "apps/web/src/views/OverviewView.tsx",
          "apps/web/src/styles.css",
          "apps/web/src/test/OverviewView.test.tsx",
          "apps/web/src/test/WorkspaceShell.test.tsx",
          "apps/web/e2e/workspace.spec.ts"
        ]
      },
      {
        "id": "information_architecture_and_research_continuity",
        "status": "implemented",
        "evidence": [
          "docs/research-workbench-architecture.md",
          "docs/reference-query-workflow-audit.md",
          "docs/design-qa.md",
          "src/pharma_intel/research_activity.py",
          "src/pharma_intel/api.py",
          "apps/web/src/ResearchApp.tsx",
          "apps/web/src/components/WorkspaceShell.tsx",
          "apps/web/src/components/ResearchTabList.tsx",
          "apps/web/src/views/OverviewView.tsx",
          "apps/web/src/views/EvidenceView.tsx",
          "apps/web/src/lib/contracts/evidence.ts",
          "apps/web/src/lib/workspaceRouting.ts",
          "apps/web/src/lib/browserAcceptanceCredentials.ts",
          "apps/web/src/test/browserCredentials.test.ts",
          "apps/web/src/test/ResearchTabList.test.tsx",
          "apps/web/src/test/CommercialView.test.tsx",
          "apps/web/src/test/CollectionsView.test.tsx",
          "apps/web/src/test/EvidenceView.test.tsx",
          "apps/web/src/test/workspaceRouting.test.ts",
          "apps/web/e2e/workspace.spec.ts",
          "scripts/run-browser-acceptance.sh",
          "tests/test_browser_runtime_contract.py"
        ]
      },
      {
        "id": "professional_composite_query_depth",
        "status": "implemented",
          "evidence": [
            "apps/web/src/components/ProfessionalQueryBuilder.tsx",
            "apps/web/src/components/FacetMultiSelect.tsx",
            "apps/web/src/components/EntityFilterSelect.tsx",
            "apps/web/src/components/EntityMultiFilterSelect.tsx",
            "apps/web/src/lib/professionalSearch.ts",
            "apps/web/src/lib/contracts/patents.ts",
            "apps/web/src/lib/contracts/deals.ts",
          "apps/web/src/views/ExplorerView.tsx",
          "apps/web/src/views/PipelineView.tsx",
          "apps/web/src/views/PatentsView.tsx",
          "apps/web/src/views/DealsView.tsx",
          "apps/web/src/lib/contracts/pipeline.ts",
          "apps/web/src/lib/workspaceRouting.ts",
          "apps/web/src/styles.css",
          "apps/web/src/test/professionalSearch.test.ts",
          "apps/web/src/test/domainContracts.test.ts",
          "apps/web/src/test/ExplorerView.test.tsx",
          "apps/web/src/test/PatentsView.test.tsx",
          "apps/web/src/test/DealsView.test.tsx",
          "apps/web/src/test/PipelineView.test.tsx",
          "tests/test_pipeline_search.py",
          "apps/web/e2e/workspace.spec.ts",
          "apps/web/e2e/visual-baselines/manifest.json",
          "docs/design-qa.md",
          "docs/reference-query-workflow-audit.md",
          "docs/research-workbench-architecture.md",
          "apps/web/src/components/AppliedFiltersBar.tsx"
        ]
      },
      {
        "id": "dense_result_operations",
        "status": "partial",
        "remaining_gaps": [
          "Complete formal licensed-data workflow review and professional-user UAT for dense tables, comparison, statistics, pagination, and controlled export."
        ],
        "evidence": [
          "docs/reference-query-workflow-audit.md",
          "apps/web/src/components/VirtualDataTable.tsx",
          "apps/web/src/lib/contracts/workspacePreferences.ts",
          "apps/web/src/test/workspacePreferencesContract.test.ts",
          "apps/web/src/lib/usePagedEntitySelection.ts",
          "apps/web/src/components/ResultPagination.tsx",
          "apps/web/src/components/DomainExportControl.tsx",
          "apps/web/src/components/ComparisonSetPickerDialog.tsx",
          "apps/web/src/views/ExplorerView.tsx",
          "apps/web/src/lib/contracts/collections.ts",
          "apps/web/src/lib/contracts/domainExports.ts",
          "apps/web/src/lib/contracts/intelligence.ts",
          "apps/web/src/lib/contracts/sorting.ts",
          "apps/web/src/lib/workspaceRouting.ts",
          "src/pharma_intel/sorting.py",
          "src/pharma_intel/search/client.py",
          "src/pharma_intel/search/service.py",
          "src/pharma_intel/repository.py",
          "src/pharma_intel/api.py",
          "src/pharma_intel/schemas.py",
          "src/pharma_intel/workspace_preferences.py",
          "migrations/versions/f3c8d5a2b740_add_workspace_table_preferences.py",
          "src/pharma_intel/comparison/service.py",
          "apps/web/src/views/PipelineView.tsx",
          "apps/web/src/components/PipelineLandscape.tsx",
          "apps/web/src/components/DealLandscape.tsx",
          "apps/web/src/components/LandscapeBarChart.tsx",
          "apps/web/src/lib/contracts/pipeline.ts",
          "src/pharma_intel/intelligence.py",
          "src/pharma_intel/mcp_server.py",
          "src/pharma_intel/models.py",
          "src/pharma_intel/governance/schemas.py",
          "src/pharma_intel/governance/service.py",
          "migrations/versions/ad7e3c1f9b42_add_versioned_program_targets.py",
          "scripts/mcp_sdk_probe.py",
          "scripts/mcp_inspector_probe.py",
          "scripts/verify-mcp-interoperability.sh",
          "apps/web/src/views/TrialsView.tsx",
          "apps/web/src/views/PatentsView.tsx",
          "apps/web/src/views/DealsView.tsx",
          "apps/web/src/views/RegulatoryView.tsx",
          "apps/web/src/views/EpidemiologyView.tsx",
          "apps/web/src/views/NewsView.tsx",
          "apps/web/src/lib/contracts/trials.ts",
          "apps/web/src/lib/contracts/patents.ts",
          "apps/web/src/lib/contracts/deals.ts",
          "apps/web/src/lib/contracts/regulatory.ts",
          "apps/web/src/lib/contracts/epidemiology.ts",
          "apps/web/src/lib/contracts/news.ts",
          "apps/web/src/test/VirtualDataTable.test.tsx",
          "apps/web/src/test/usePagedEntitySelection.test.ts",
          "apps/web/src/test/ResultPagination.test.tsx",
          "apps/web/src/test/ExplorerView.test.tsx",
          "apps/web/src/test/domainContracts.test.ts",
          "apps/web/src/test/sorting.test.ts",
          "apps/web/src/test/workspaceRouting.test.ts",
          "apps/web/src/test/PipelineView.test.tsx",
          "apps/web/src/test/TrialsView.test.tsx",
          "apps/web/src/test/PatentsView.test.tsx",
          "apps/web/src/test/DealsView.test.tsx",
          "apps/web/src/test/RegulatoryView.test.tsx",
          "apps/web/src/test/EpidemiologyView.test.tsx",
          "apps/web/src/test/NewsView.test.tsx",
          "tests/test_pipeline_search.py",
          "tests/test_clinical_trial_search.py",
          "tests/test_patent_search.py",
          "tests/test_deal_search.py",
          "tests/test_regulatory_search.py",
          "tests/test_epidemiology_search.py",
          "tests/test_news_search.py",
          "tests/test_comparison.py",
          "tests/test_comparison_postgres.py",
          "tests/test_workspace_preferences.py",
          "tests/test_workspace_preferences_postgres.py",
          "migrations/versions/9e2f4a6c8b10_add_workspace_domain_exports.py",
          "scripts/verify-comparison-postgres.sh",
          "scripts/verify-workspace-preferences-postgres.sh",
          "scripts/verify_postgres_migration_roundtrip.py",
          "tests/test_mcp_server.py",
          "tests/test_search_client.py",
          "tests/test_sorting.py",
          "tests/test_commercial_api.py",
          "tests/test_repository.py",
          "tests/test_postgres_repository.py",
          "tests/test_opensearch_integration.py",
          "scripts/run-browser-acceptance.sh",
          "apps/web/e2e/workspace.spec.ts",
          "apps/web/src/test/DomainExportControl.test.tsx",
          "apps/web/src/test/domainExports.test.ts",
          "apps/web/src/styles.css"
        ]
      },
      {
        "id": "entity_dossiers_and_cross_domain_links",
        "status": "implemented",
        "evidence": [
          "docs/reference-query-workflow-audit.md",
          "docs/research-workbench-architecture.md",
          "docs/design-qa.md",
          "apps/web/src/ResearchApp.tsx",
          "apps/web/src/views/PipelineView.tsx",
          "apps/web/src/components/PipelineLandscape.tsx",
          "apps/web/src/test/PipelineView.test.tsx",
          "src/pharma_intel/api.py",
          "src/pharma_intel/intelligence.py",
          "apps/web/src/views/TargetView.tsx",
          "apps/web/src/views/DrugView.tsx",
          "apps/web/src/views/CompanyView.tsx",
          "apps/web/src/views/DiseaseView.tsx",
          "apps/web/src/views/TrialsView.tsx",
          "apps/web/src/views/DealsView.tsx",
          "apps/web/src/views/RegulatoryView.tsx",
          "apps/web/src/views/EntityDossierView.tsx",
          "apps/web/src/views/PatentsView.tsx",
          "apps/web/src/views/NewsView.tsx",